{
  "column" : {
    "gutter" : 0,
    "headAtMargin" : false,
    "labelAlign" : "right",
    "labelWidth" : 0,
    "ruled" : false
  },
  "entries" : {
    "accentRoles" : false,
    "bodySize" : 9.4,
    "dateSize" : 8.5,
    "dates" : "besideTitle",
    "detailSize" : 9.2,
    "entryGap" : 14,
    "roleSize" : 10.4,
    "skills" : "list"
  },
  "footer" : true,
  "heading" : {
    "colour" : "muted",
    "icon" : false,
    "size" : 7.6,
    "style" : "ruled"
  },
  "masthead" : {
    "align" : "left",
    "contactSize" : 8.7,
    "contacts" : "flow",
    "gapAfter" : 19,
    "headlineColour" : "accent",
    "headlineItalic" : false,
    "headlineSize" : 10.8,
    "monospaced" : false,
    "nameColour" : "ink",
    "nameSize" : 25.5,
    "nameWeight" : "semibold",
    "photo" : {
      "align" : "right",
      "diameter" : 66
    },
    "qr" : 0,
    "rule" : {
      "colour" : "ink",
      "double" : false,
      "thickness" : 0.9,
      "underName" : false,
      "width" : 0
    },
    "separator" : "·",
    "tracking" : -0.4,
    "twin" : false,
    "uppercase" : false
  },
  "name" : "sidebar",
  "ornament" : "none",
  "sectionGap" : 16,
  "sections" : {

  },
  "side" : {
    "divider" : false,
    "edge" : "left",
    "entries" : {
      "accentRoles" : false,
      "bodySize" : 8.7,
      "dateSize" : 8,
      "dates" : "beneath",
      "detailSize" : 8.6,
      "entryGap" : 10,
      "roleSize" : 9.6,
      "skills" : "list"
    },
    "fill" : "rail",
    "gutter" : 30,
    "head" : "inside",
    "heading" : {
      "colour" : "accent",
      "icon" : false,
      "size" : 7.4,
      "style" : "plain"
    },
    "inset" : 27,
    "sections" : [
      "skills",
      "languages",
      "education",
      "certifications",
      "interests"
    ],
    "width" : 190
  },
  "skip" : [

  ],
  "typeface" : "sans"
}
