{
  "column" : {
    "gutter" : 0,
    "headAtMargin" : false,
    "labelAlign" : "right",
    "labelWidth" : 0,
    "ruled" : false
  },
  "entries" : {
    "accentRoles" : false,
    "bodySize" : 9.4,
    "dateSize" : 8.5,
    "dates" : "besideTitle",
    "detailSize" : 9.2,
    "entryGap" : 15,
    "roleSize" : 10.4,
    "skills" : "bars"
  },
  "footer" : true,
  "heading" : {
    "colour" : "ink",
    "icon" : false,
    "size" : 12,
    "style" : "marker"
  },
  "masthead" : {
    "align" : "centre",
    "contactSize" : 8.7,
    "contacts" : "flow",
    "gapAfter" : 14,
    "headlineColour" : "muted",
    "headlineItalic" : false,
    "headlineSize" : 10.8,
    "monospaced" : false,
    "nameColour" : "ink",
    "nameSize" : 28,
    "nameWeight" : "semibold",
    "qr" : 0,
    "rule" : {
      "colour" : "accent",
      "double" : false,
      "thickness" : 2.6,
      "underName" : true,
      "width" : 0
    },
    "separator" : "▪",
    "tracking" : -0.5,
    "twin" : false,
    "uppercase" : false
  },
  "name" : "marker",
  "ornament" : "none",
  "sectionGap" : 18,
  "sections" : {

  },
  "skip" : [

  ],
  "typeface" : "sans"
}
