{
  "column" : {
    "gutter" : 0,
    "headAtMargin" : false,
    "labelAlign" : "right",
    "labelWidth" : 0,
    "ruled" : false
  },
  "entries" : {
    "accentRoles" : false,
    "bodySize" : 9.7,
    "dateSize" : 8.5,
    "dates" : "besideTitle",
    "detailSize" : 9.5,
    "entryGap" : 14,
    "roleSize" : 10.6,
    "skills" : "list"
  },
  "footer" : true,
  "heading" : {
    "colour" : "muted",
    "icon" : false,
    "size" : 8,
    "style" : "centred"
  },
  "masthead" : {
    "align" : "centre",
    "contactSize" : 8.8,
    "contacts" : "flow",
    "gapAfter" : 20,
    "headlineColour" : "muted",
    "headlineItalic" : true,
    "headlineSize" : 10.6,
    "monospaced" : false,
    "nameColour" : "ink",
    "nameSize" : 19,
    "nameWeight" : "regular",
    "qr" : 0,
    "rule" : {
      "colour" : "ink",
      "double" : true,
      "thickness" : 0.7,
      "underName" : false,
      "width" : 0
    },
    "separator" : "·",
    "tracking" : 2.2,
    "twin" : false,
    "uppercase" : true
  },
  "name" : "broadsheet",
  "ornament" : "none",
  "sectionGap" : 18,
  "sections" : {

  },
  "skip" : [

  ],
  "typeface" : "serif"
}
