{
  "column" : {
    "gutter" : 0,
    "headAtMargin" : false,
    "labelAlign" : "right",
    "labelWidth" : 0,
    "ruled" : false
  },
  "entries" : {
    "accentRoles" : false,
    "bodySize" : 9.4,
    "dateSize" : 8.5,
    "dates" : "besideTitle",
    "detailSize" : 9.2,
    "entryGap" : 14,
    "roleSize" : 10.4,
    "skills" : "chips"
  },
  "footer" : true,
  "heading" : {
    "colour" : "ink",
    "icon" : true,
    "size" : 8.2,
    "style" : "tab"
  },
  "masthead" : {
    "align" : "left",
    "contactSize" : 8.7,
    "contacts" : "flow",
    "gapAfter" : 16,
    "headlineColour" : "accent",
    "headlineItalic" : false,
    "headlineSize" : 11,
    "monospaced" : false,
    "nameColour" : "ink",
    "nameSize" : 25,
    "nameWeight" : "semibold",
    "photo" : {
      "align" : "right",
      "diameter" : 78
    },
    "qr" : 0,
    "rule" : null,
    "separator" : "·",
    "tracking" : -0.4,
    "twin" : false,
    "uppercase" : false
  },
  "name" : "bulletin",
  "ornament" : "none",
  "sectionGap" : 16,
  "sections" : {

  },
  "skip" : [

  ],
  "typeface" : "sans"
}
