{
  "column" : {
    "gutter" : 0,
    "headAtMargin" : false,
    "labelAlign" : "right",
    "labelWidth" : 0,
    "ruled" : false
  },
  "entries" : {
    "accentRoles" : false,
    "bodySize" : 9.4,
    "dateSize" : 8.5,
    "dates" : "besideTitle",
    "detailSize" : 9.2,
    "entryGap" : 14,
    "roleSize" : 10.4,
    "skills" : "chips"
  },
  "footer" : true,
  "heading" : {
    "colour" : "accent",
    "icon" : false,
    "size" : 7.6,
    "style" : "accentBar"
  },
  "masthead" : {
    "align" : "left",
    "contactSize" : 8.7,
    "contacts" : "flow",
    "gapAfter" : 10,
    "headlineColour" : "accent",
    "headlineItalic" : false,
    "headlineSize" : 10.8,
    "monospaced" : false,
    "nameColour" : "ink",
    "nameSize" : 27,
    "nameWeight" : "semibold",
    "panel" : {
      "dip" : 26,
      "fill" : "accent",
      "height" : 172
    },
    "photo" : {
      "align" : "right",
      "diameter" : 66
    },
    "qr" : 0,
    "rule" : null,
    "separator" : "·",
    "tracking" : -0.4,
    "twin" : false,
    "uppercase" : false
  },
  "name" : "plaqued",
  "ornament" : "none",
  "sectionGap" : 16,
  "sections" : {

  },
  "skip" : [

  ],
  "typeface" : "sans"
}
